{
  "schemaVersion": 1,
  "generatedAt": "2026-09-26T18:00:00Z",
  "generator": { "mcpVersion": "9.9.9" },
  "project": {
    "name": "CodedFirst",
    "entryPoint": null,
    "additionalEntryPoints": ["Entry.cs"],
    "overview": ""
  },
  "nodes": [
    {
      "id": "Entry.cs",
      "kind": "coded",
      "sha256": "eeeeeeeeeeeeeeeeeeeeeeeeeeeeeeeeeeeeeeeeeeeeeeeeeeeeeeeeeeeeeeee",
      "arguments": [],
      "hasExceptionHandler": false,
      "parseError": null,
      "explanation": "Coded entry.",
      "decisions": []
    }
  ],
  "edges": []
}
