{
  "schemaVersion": 1,
  "generatedAt": "2026-09-26T16:00:00Z",
  "generator": { "mcpVersion": "9.9.9" },
  "project": {
    "name": "Dispatch",
    "entryPoint": "Main.xaml",
    "additionalEntryPoints": [],
    "overview": "Reads the queue and dispatches work."
  },
  "nodes": [
    {
      "id": "Main.xaml",
      "kind": "xaml",
      "sha256": "17ab370c8c4acebf3ac18de004d3d50e5b40e4b6b415193f90a77a7174d6ce25",
      "arguments": [{ "name": "in_Config", "direction": "In", "type": "Dictionary<String,Object>" }],
      "hasExceptionHandler": true,
      "parseError": null,
      "explanation": "Starts the process.",
      "decisions": ["Route by status"]
    },
    {
      "id": "Child.xaml",
      "kind": "xaml",
      "sha256": "9f378d60d8a9ef7756e9b75222142dc017ef122e1547cda362bfd15b161f8855",
      "arguments": [],
      "hasExceptionHandler": false,
      "parseError": null,
      "explanation": "",
      "decisions": []
    },
    {
      "id": "Grand.xaml",
      "kind": "xaml",
      "sha256": "ec5583cd13079244a2e1bd627fd6967d4ce3f9f33325b489712d7a41e4b14ff1",
      "arguments": [],
      "hasExceptionHandler": false,
      "parseError": "Invalid XML at line 5.",
      "explanation": "Finishes the item.",
      "decisions": []
    },
    {
      "id": "CycleA.xaml",
      "kind": "xaml",
      "sha256": "aaaaaaaaaaaaaaaaaaaaaaaaaaaaaaaaaaaaaaaaaaaaaaaaaaaaaaaaaaaaaaaa",
      "arguments": [],
      "hasExceptionHandler": false,
      "parseError": null,
      "explanation": "Cycle A.",
      "decisions": []
    },
    {
      "id": "CycleB.xaml",
      "kind": "xaml",
      "sha256": "bbbbbbbbbbbbbbbbbbbbbbbbbbbbbbbbbbbbbbbbbbbbbbbbbbbbbbbbbbbbbbbb",
      "arguments": [],
      "hasExceptionHandler": false,
      "parseError": null,
      "explanation": "Cycle B.",
      "decisions": []
    },
    {
      "id": "Orphan.xaml",
      "kind": "xaml",
      "sha256": "cccccccccccccccccccccccccccccccccccccccccccccccccccccccccccccccc",
      "arguments": [],
      "hasExceptionHandler": false,
      "parseError": null,
      "explanation": "Unused.",
      "decisions": []
    },
    {
      "id": "Helper.cs",
      "kind": "coded",
      "sha256": "dddddddddddddddddddddddddddddddddddddddddddddddddddddddddddddddd",
      "arguments": [{ "name": "name", "direction": "In", "type": "string" }],
      "hasExceptionHandler": true,
      "parseError": null,
      "explanation": "Coded helper.",
      "decisions": []
    }
  ],
  "edges": [
    {
      "sourceWorkflow": "Main.xaml",
      "targetWorkflow": "Child.xaml",
      "displayName": "Run child",
      "isResolved": true,
      "argumentMappings": []
    },
    {
      "sourceWorkflow": "Child.xaml",
      "targetWorkflow": "Grand.xaml",
      "displayName": "Run grand",
      "isResolved": true,
      "argumentMappings": [
        { "direction": "In", "targetArgument": "in_Config", "expression": "[Config]" }
      ]
    },
    {
      "sourceWorkflow": "CycleA.xaml",
      "targetWorkflow": "CycleB.xaml",
      "displayName": "To B",
      "isResolved": true,
      "argumentMappings": []
    },
    {
      "sourceWorkflow": "CycleB.xaml",
      "targetWorkflow": "CycleA.xaml",
      "displayName": "To A",
      "isResolved": true,
      "argumentMappings": []
    },
    {
      "sourceWorkflow": "Main.xaml",
      "targetWorkflow": "Missing.xaml",
      "displayName": "Missing target",
      "isResolved": false,
      "argumentMappings": []
    }
  ]
}
