{
  "schemaVersion": 1,
  "generatedAt": "2026-09-26T16:00:00Z",
  "generator": { "mcpVersion": "9.9.9" },
  "project": { "name": "X", "entryPoint": null, "additionalEntryPoints": [], "overview": "" },
  "nodes": [
    { "id": "Main.xaml", "kind": "xaml", "sha256": "aa", "arguments": [], "hasExceptionHandler": false, "parseError": null, "explanation": "", "decisions": [] },
    { "id": "Main.xaml", "kind": "xaml", "sha256": "bb", "arguments": [], "hasExceptionHandler": false, "parseError": null, "explanation": "", "decisions": [] }
  ],
  "edges": []
}
